{
  "policy": "i18n",
  "generatedAt": "2026-06-13T22:37:00.120Z",
  "target": "http://localhost:8080",
  "phase": "verify",
  "viewports": [
    "desktop",
    "mobile"
  ],
  "summary": {
    "pages": 2,
    "totalViolations": 0,
    "byImpact": {}
  },
  "pages": [
    {
      "url": "http://localhost:8080/index.html",
      "path": "/index.html",
      "slug": "index",
      "screenshots": {
        "desktop": "reports/i18n/current/index-desktop.png",
        "mobile": "reports/i18n/current/index-mobile.png"
      },
      "violations": []
    },
    {
      "url": "http://localhost:8080/about.html",
      "path": "/about.html",
      "slug": "about",
      "screenshots": {
        "desktop": "reports/i18n/current/about-desktop.png",
        "mobile": "reports/i18n/current/about-mobile.png"
      },
      "violations": []
    }
  ]
}